{
  "schemaVersion": "1.0.0",
  "stage": "environment-bootstrap",
  "codeIndexable": false,
  "activeProfiles": [
    "documentation",
    "harness-tooling"
  ],
  "harnesses": [
    "codex",
    "claude-code",
    "cursor",
    "opencode",
    "github-copilot"
  ],
  "githubMode": "dry-run",
  "branchStrategy": {
    "status": "manual-pending",
    "defaultBranch": null,
    "protectedBranches": [],
    "changeBranchPrefix": null
  }
}
